priority,cohort_name,title_template,content_template
1,Rajaji_Nagar_n2b_15km,{your pet} called dibs 🐾,"Hey {pet parent}, Supertails+ Clinic is now open in Rajajinagar. Walk in for vet consults, grooming & everything {your pet} needs @25% off.🏥💜"
2,Clinic_KN_Mar'26,Still haven’t visited? 👀,"{pet parent}, your nearby clinic is waiting. Drop by for grooming & care, plus enjoy 50% off grooming.🏥💜"
3,Clinic_Birthday_Mar26,No basic birthdays allowed 🎉,"Hey {pet parent}, upgrade {your pet}’s special day with 50% OFF grooming at Supertails+ Clinic.🏥💜"
4,Clinic_Dental_N2B_Mar'26,That breath… we need to talk 😬,"{pet parent}, if {your pet}’s dental health feels off, get a FREE dental checkup at Supertails+ Clinic.🏥💜"
5,Clinic_Double_pet_parents_Mar26,Double pets = double flex 😌,"Hey {pet parent}, bring a new pet parent along & enjoy Buy 1 Get 1 FREE grooming at our clinic.🏥💜"
6,N2B_All_Bangalore,First vet visit needs a strong start!✨,"{pet parent}, choose Supertails+ Clinic for calm care. Get ₹500 OFF on your first visit for {your pet}.🏥💜"
